{
  "schema": 1,
  "artifact": "fixture-007",
  "readiness": "smoke-ready",
  "distribution": {
    "state": "release-image",
    "runtime_class": "transitional-node",
    "image": "ghcr.io/cordanallm/20-watts-was-enough-fixture-007",
    "platforms": ["linux/amd64"],
    "build_context": "closed-go-package",
    "dockerfile": "experiments/workstation/Dockerfile.node-artifact",
    "authority": "NO_RESULT"
  },
  "command": {
    "prepare": "node experiments/workstation/fixture-007/runner.mjs prepare --profile smoke",
    "smoke": "node experiments/workstation/fixture-007/runner.mjs smoke --profile smoke --output <run-directory>",
    "run": "node experiments/workstation/fixture-007/runner.mjs run --profile development --output <run-directory>",
    "analyze": "node experiments/workstation/fixture-007/runner.mjs analyze --output <run-directory>",
    "validate": "node experiments/workstation/fixture-007/runner.mjs validate --output <run-directory>"
  },
  "environment": {
    "runtime": "Node.js 26.10.0 in the release-admitted Linux amd64 scoped OCI image; published only by a passing v0.3.0 or later release workflow",
    "lockfiles": ["package-lock.json"]
  },
  "hardware": {
    "smoke": {
      "cpu": "one x64 CPU thread or more",
      "memory_bytes": 134217728,
      "disk_bytes": 52428800,
      "energy": "modeled fixture value only; no measured joules"
    },
    "workstation": {
      "cpu": "x64 CPU plus independently calibrated optical acquisition adapter",
      "memory_bytes": 1073741824,
      "disk_bytes": 1073741824,
      "energy": "external calibrated wall or rail meter required before workstation-ready promotion"
    }
  },
  "seeds": {
    "development": "experiments/workstation/fixture-007/seeds/development.json",
    "confirmation": "experiments/workstation/fixture-007/seeds/confirmation.commit.json",
    "held_out": "experiments/workstation/fixture-007/seeds/held-out.commit.json"
  },
  "data": {
    "generator": "experiments/workstation/fixture-007/generator.mjs",
    "full_profile": "experiments/workstation/fixture-007/configs/development.json",
    "full_profile_sha256": "6bcf4584bdd5bb03be02a919e2be2f5f9ffbf1213dfa4f3b85bcad648f979e77",
    "external": []
  },
  "outputs": {
    "directory": "experiments/workstation/runs/fixture-007-*",
    "schema": "experiments/workstation/fixture-007/output.schema.json",
    "execution_receipt": "run.json#execution_receipt (experiment.execution-receipt.v1; NO_RESULT; exact digest required for a release image)",
    "append_only": true,
    "hash_chain": true
  },
  "implementation": {
    "entrypoint": "experiments/workstation/fixture-007/runner.mjs",
    "tests": [
      "experiments/workstation/fixture-007/contract.test.mjs",
      "experiments/workstation/fixture-007/runner.test.mjs"
    ],
    "full_tests": [
      "experiments/workstation/fixture-007/contract.test.mjs",
      "experiments/workstation/fixture-007/runner.test.mjs"
    ],
    "execution_claims": ["C-970", "C-972"]
  },
  "energy": {
    "mode": "modeled-fixture-only",
    "required": false
  },
  "resume": {
    "supported": false
  },
  "promotion_evidence": {
    "status": "pending",
    "evidence_path": "experiments/workstation/promotion/fixture-007/evidence.json",
    "promotion_validation_receipt_path": "experiments/workstation/promotion/fixture-007/promotion-validation.launch-receipt.json",
    "run_directory": "experiments/workstation/runs/fixture-007-confirmation",
    "release_root": "experiments/workstation/releases/fixture-007",
    "release_path": "experiments/workstation/releases/fixture-007/confirmation.release.json",
    "energy_assignments_path": "experiments/workstation/runs/fixture-007-confirmation/energy-assignments.json",
    "disjoint_seed_pack_paths": [
      "experiments/workstation/releases/fixture-007/held-out.reveal.json"
    ]
  }
}
