{
  "schema": 1,
  "artifact": "fixture-024",
  "readiness": "smoke-ready",
  "distribution": {
    "state": "source-only",
    "runtime_class": "node-source",
    "authority": "NO_RESULT"
  },
  "command": {
    "prepare": "node experiments/workstation/fixture-024/runner.mjs prepare --profile smoke",
    "smoke": "node experiments/workstation/fixture-024/runner.mjs smoke --profile smoke --output <run-directory> --resume false",
    "run": "node experiments/workstation/fixture-024/runner.mjs run --profile development --output <run-directory> --resume false",
    "analyze": "node experiments/workstation/fixture-024/runner.mjs analyze --output <run-directory>",
    "validate": "node experiments/workstation/fixture-024/runner.mjs validate --output <run-directory>"
  },
  "environment": {
    "runtime": "Node.js 26.10.0 on a little-endian CPU; binary64 arithmetic only",
    "lockfiles": ["package-lock.json"]
  },
  "hardware": {
    "smoke": {
      "cpu": "one ordinary little-endian CPU thread or more",
      "memory_bytes": 134217728,
      "disk_bytes": 52428800,
      "energy": "not measured or modeled; energy conclusions forbidden"
    },
    "workstation": {
      "cpu": "ordinary little-endian CPU; no workstation claim is registered",
      "memory_bytes": 1073741824,
      "disk_bytes": 1073741824,
      "energy": "not applicable to this development smoke slice; energy conclusions forbidden"
    }
  },
  "seeds": {
    "development": "experiments/workstation/fixture-024/seeds/development.reveal.json",
    "confirmation": "experiments/workstation/fixture-024/seeds/confirmation.unavailable.json",
    "held_out": "experiments/workstation/fixture-024/seeds/transfer.unavailable.json"
  },
  "data": {
    "generator": "experiments/workstation/fixture-024/generator.mjs",
    "full_profile": "experiments/workstation/fixture-024/configs/development.json",
    "full_profile_sha256": "7b85ca70ab8c9bc7a7d5b7829ceb69a633764f9a0316783ff1cc3b707930c926",
    "external": []
  },
  "outputs": {
    "directory": "experiments/workstation/runs/fixture-024-*",
    "schema": "experiments/workstation/fixture-024/output.schema.json",
    "append_only": true,
    "hash_chain": true
  },
  "implementation": {
    "entrypoint": "experiments/workstation/fixture-024/runner.mjs",
    "tests": [
      "experiments/workstation/fixture-024/contract.test.mjs",
      "experiments/workstation/fixture-024/runner.test.mjs"
    ],
    "full_tests": [
      "experiments/workstation/fixture-024/contract.test.mjs",
      "experiments/workstation/fixture-024/runner.test.mjs"
    ],
    "execution_claims": ["C-1526"]
  },
  "energy": {
    "mode": "not-measured",
    "required": false,
    "applicability": "not-applicable-to-scoped-claim",
    "energy_conclusion_allowed": false,
    "scope_binding": "fixture-024.c-1526.development-smoke.non-energy.v1",
    "not_applicable_reason": "AMR-T01 smoke validation records synthetic state error and deterministic work counters only; it has no joule, watt, carbon, or energy-efficiency endpoint."
  },
  "resume": {
    "supported": true,
    "module": "experiments/workstation/lib/checkpoint-ledger.mjs",
    "test": "experiments/workstation/fixture-024/runner.test.mjs"
  },
  "promotion_evidence": {
    "status": "pending",
    "evidence_path": "experiments/workstation/promotion/fixture-024/evidence.json",
    "promotion_validation_receipt_path": "experiments/workstation/promotion/fixture-024/promotion-validation.launch-receipt.json",
    "run_directory": "experiments/workstation/runs/fixture-024-confirmation",
    "release_root": "experiments/workstation/releases/fixture-024",
    "release_path": "experiments/workstation/releases/fixture-024/confirmation.release.json",
    "energy_assignments_path": "experiments/workstation/runs/fixture-024-confirmation/non-energy-boundary.json",
    "disjoint_seed_pack_paths": [
      "experiments/workstation/fixture-024/seeds/transfer.unavailable.json"
    ],
    "protocol_eligibility": {
      "status": "blocked",
      "protocol_version": "F-024/AMR-T01-development-smoke-v1",
      "claim_scope": ["C-1526"],
      "blockers": [
        "Only public development generator plumbing and analytical arms are implemented.",
        "The exact augmented-state ceiling receives evaluator state and is not a matched-information confirmation comparator.",
        "No confirmation or transfer seed, commitment, release, statistical adjudication, or promotion evidence exists."
      ]
    }
  }
}
