{
  "schema": 1,
  "artifact": "fixture-029",
  "readiness": "smoke-ready",
  "distribution": {
    "state": "source-only",
    "runtime_class": "node-source",
    "authority": "NO_RESULT"
  },
  "command": {
    "prepare": "node experiments/workstation/fixture-029/suite-runner.mjs prepare --profile smoke",
    "smoke": "node experiments/workstation/fixture-029/suite-runner.mjs smoke --profile smoke --output <run-directory> --resume false",
    "run": "node experiments/workstation/fixture-029/suite-runner.mjs run --profile development --output <run-directory> --resume false",
    "analyze": "node experiments/workstation/fixture-029/suite-runner.mjs analyze --output <run-directory>",
    "validate": "node experiments/workstation/fixture-029/suite-runner.mjs validate --output <run-directory>"
  },
  "environment": {
    "runtime": "Node.js 26.12.0 on a little-endian CPU; binary64 arithmetic only; no GPU",
    "lockfiles": ["package-lock.json"]
  },
  "hardware": {
    "smoke": {
      "cpu": "one ordinary little-endian CPU thread; GPU forbidden",
      "memory_bytes": 134217728,
      "disk_bytes": 52428800,
      "energy": "not measured or modeled; energy conclusions forbidden"
    },
    "workstation": {
      "cpu": "ordinary little-endian CPU; no workstation-ready claim is registered",
      "memory_bytes": 1073741824,
      "disk_bytes": 1073741824,
      "energy": "not applicable to this public-development construction slice; energy conclusions forbidden"
    }
  },
  "seeds": {
    "development": "experiments/workstation/fixture-029/seeds/development.reveal.json",
    "confirmation": "experiments/workstation/fixture-029/seeds/confirmation.unavailable.json",
    "held_out": "experiments/workstation/fixture-029/seeds/transfer.unavailable.json"
  },
  "data": {
    "generator": "experiments/workstation/fixture-029/suite-runner.mjs",
    "full_profile": "experiments/workstation/fixture-029/configs/suite-development.json",
    "full_profile_sha256": "ebeae608bbed43c8925166d23196b5e757a4d16981c86f61ede55c22f5a4e34f",
    "external": []
  },
  "outputs": {
    "directory": "experiments/workstation/runs/fixture-029-suite-*",
    "schema": "experiments/workstation/fixture-029/suite-receipt.schema.json",
    "analysis_schema": "experiments/workstation/fixture-029/suite-output.schema.json",
    "append_only": true,
    "hash_chain": true
  },
  "implementation": {
    "entrypoint": "experiments/workstation/fixture-029/suite-runner.mjs",
    "tests": [
      "experiments/workstation/fixture-029/cmb-x01-contract.test.mjs",
      "experiments/workstation/fixture-029/cmb-x01-runner.test.mjs",
      "experiments/workstation/fixture-029/contract.test.mjs",
      "experiments/workstation/fixture-029/runner-io.test.mjs",
      "experiments/workstation/fixture-029/runner.test.mjs",
      "experiments/workstation/fixture-029/suite-runner-integrity.test.mjs",
      "experiments/workstation/fixture-029/suite-runner.test.mjs"
    ],
    "full_tests": [
      "experiments/workstation/fixture-029/cmb-x01-contract.test.mjs",
      "experiments/workstation/fixture-029/cmb-x01-runner.test.mjs",
      "experiments/workstation/fixture-029/contract.test.mjs",
      "experiments/workstation/fixture-029/runner-io.test.mjs",
      "experiments/workstation/fixture-029/runner.test.mjs",
      "experiments/workstation/fixture-029/suite-runner-integrity.test.mjs",
      "experiments/workstation/fixture-029/suite-runner.test.mjs"
    ],
    "execution_claims": ["C-1574", "C-1580"]
  },
  "energy": {
    "mode": "not-measured",
    "required": false,
    "applicability": "not-applicable-to-scoped-claim",
    "energy_conclusion_allowed": false,
    "scope_binding": "fixture-029.c-1574-c-1580.development-smoke.non-energy.v2",
    "not_applicable_reason": "CMB-X01/CMB-X04 aggregate-construction records contain deterministic scoped synthetic inventory, operation, byte, and byte-step counters only; they contain no joule, watt, carbon, calibrated apparatus, comparative energy, or energy-efficiency endpoint."
  },
  "resume": {
    "supported": true,
    "module": "experiments/workstation/lib/checkpoint-ledger.mjs",
    "test": "experiments/workstation/fixture-029/suite-runner.test.mjs"
  },
  "promotion_evidence": {
    "status": "pending",
    "evidence_path": "experiments/workstation/promotion/fixture-029/evidence.json",
    "promotion_validation_receipt_path": "experiments/workstation/promotion/fixture-029/promotion-validation.launch-receipt.json",
    "run_directory": "experiments/workstation/runs/fixture-029-confirmation",
    "release_root": "experiments/workstation/releases/fixture-029",
    "release_path": "experiments/workstation/releases/fixture-029/confirmation.release.json",
    "energy_assignments_path": "experiments/workstation/runs/fixture-029-confirmation/non-energy-boundary.json",
    "disjoint_seed_pack_paths": [
      "experiments/workstation/fixture-029/seeds/transfer.unavailable.json"
    ],
    "protocol_eligibility": {
      "status": "blocked",
      "protocol_version": "F-029/CMB-X01+CMB-X04-public-development-aggregate-construction-v2",
      "claim_scope": ["C-1574", "C-1580"],
      "blockers": [
        "Only aggregate public-development CMB-X01 and CMB-X04 construction records exist; complete protocol-native action events and CMB-X02/CMB-X03 are absent.",
        "Independent implementations, pilot-based margins, frozen strongest-null selection, confirmatory statistics, and hostile transfer are absent for both implemented tracks.",
        "Declared synthetic resource counters do not establish complete lifecycle or comparative accounting for either track.",
        "No confirmation or held-out seed, commitment, release, promotion evidence, calibrated physical resource boundary, or energy measurement exists.",
        "Every subrun record, suite receipt, analysis, validation, and command response is explicitly labelled NO_RESULT; cross-track comparison and ranking are forbidden."
      ]
    }
  }
}
